text,language,label,label_num,clean_text
"Vaccine available ani cheppadam valla crowd vasthundi, but limited doses",Tenglish,relevant,1,vaccine available ani cheppadam valla crowd vasthundi but limited doses
Widow pension ki documents complete chesina kuda monthly payment raledu,Tenglish,relevant,1,widow pension ki documents complete chesina kuda monthly payment raledu
Pregnant ladies ki hospital lo emergency time lo ambulance arrange cheyyatam delay avutundi,Tenglish,relevant,1,pregnant ladies ki hospital lo emergency time lo ambulance arrange cheyyatam delay avutundi
Flood relief camp lo food supply timely ga lekapovadam valla people suffer chestunnaru,Tenglish,relevant,1,flood relief camp lo food supply timely ga lekapovadam valla people suffer chestunnaru
Open area lo garbage pile perigipovadam valla cows and dogs food laga tinutunnayi,Tenglish,relevant,1,open area lo garbage pile perigipovadam valla cows and dogs food laga tinutunnayi
School ki computer lab undi kani lab assistant post empty ga undi,Tenglish,relevant,1,school ki computer lab undi kani lab assistant post empty ga undi
Disability certificate ki medical officer approval lekapovadam valla delay avtundi,Tenglish,relevant,1,disability certificate ki medical officer approval lekapovadam valla delay avtundi
Rainy season lo bridge meda sand accumulation valla two-wheelers skid avtunnayi,Tenglish,relevant,1,rainy season lo bridge meda sand accumulation valla twowheelers skid avtunnayi
పిల్లలకి ఉన్న ప్రభుత్వ పాఠశాలలో తగినంత టీచర్లు లేరు.,Telugu ,relevant,1,పిల్లలకి ఉన్న ప్రభుత్వ పాఠశాలలో తగినంత టీచర్లు లేరు
రేషన్ దుకాణంలో బియ్యం పూర్తిగా ఇవ్వడం లేదు.,Telugu ,relevant,1,రేషన్ దుకాణంలో బియ్యం పూర్తిగా ఇవ్వడం లేదు
పట్టణంలోని రోడ్లన్నీ గుంతలతో నిండి ఉన్నాయి.,Telugu ,relevant,1,పట్టణంలోని రోడ్లన్నీ గుంతలతో నిండి ఉన్నాయి
ఆసుపత్రికి వెళ్ళాలంటే గంటల తరబడి లైన్‌లో నిలబడ్డే పరిస్థితి.,Telugu ,relevant,1,ఆసుపత్రికి వెళ్ళాలంటే గంటల తరబడి లైన్లో నిలబడ్డే పరిస్థితి
చెత్త సకాలంలో తీసిపోక మురుగునీరు గుట్టలుగా మారుతోంది.,Telugu ,relevant,1,చెత్త సకాలంలో తీసిపోక మురుగునీరు గుట్టలుగా మారుతోంది
ప్రభుత్వ కార్యాలయాల్లో ఉద్యోగులు సమయానికి రారు.,Telugu ,relevant,1,ప్రభుత్వ కార్యాలయాల్లో ఉద్యోగులు సమయానికి రారు
పాలింటి దగ్గర ట్రాఫిక్ లైట్స్ పనిచేయడం లేదు.,Telugu ,relevant,1,పాలింటి దగ్గర ట్రాఫిక్ లైట్స్ పనిచేయడం లేదు
మహిళలు రాత్రి బయట తిరగడం సురక్షితం కాదు.,Telugu ,relevant,1,మహిళలు రాత్రి బయట తిరగడం సురక్షితం కాదు
సమస్యను చెబితే అధికారుల నుంచి స్పందన లేదు.,Telugu ,relevant,1,సమస్యను చెబితే అధికారుల నుంచి స్పందన లేదు
వృద్ధులకి పెన్షన్ రెగ్యులర్‌గా రావడం లేదు.,Telugu ,relevant,1,వృద్ధులకి పెన్షన్ రెగ్యులర్గా రావడం లేదు
చిన్న గ్రామాలకు బస్సులు నడవడం లేదని విద్యార్థులు బడికి వెళ్లలేరు.,Telugu ,relevant,1,చిన్న గ్రామాలకు బస్సులు నడవడం లేదని విద్యార్థులు బడికి వెళ్లలేరు
ప్రజలు ప్రభుత్వ సేవల గురించి తెలియక ఇబ్బందులు పడుతున్నారు.,Telugu ,relevant,1,ప్రజలు ప్రభుత్వ సేవల గురించి తెలియక ఇబ్బందులు పడుతున్నారు
గ్రామాల్లో నీటి సమస్య తీవ్రంగా ఉంది.,Telugu ,relevant,1,గ్రామాల్లో నీటి సమస్య తీవ్రంగా ఉంది
రెయిన్‌వాటర్ డ్రైనేజీ లేక రోడ్లు మునిగిపోతున్నాయి.,Telugu ,relevant,1,రెయిన్వాటర్ డ్రైనేజీ లేక రోడ్లు మునిగిపోతున్నాయి
గత నెల నుంచి స్ట్రీట్ లైట్స్ పనిచేయడం లేదు.,Telugu ,relevant,1,గత నెల నుంచి స్ట్రీట్ లైట్స్ పనిచేయడం లేదు
ప్రభుత్వ ఆసుపత్రిలో మందులు లేక రోగులు ప్రైవేటు షాపుల్లో కొంటున్నారు.,Telugu ,relevant,1,ప్రభుత్వ ఆసుపత్రిలో మందులు లేక రోగులు ప్రైవేటు షాపుల్లో కొంటున్నారు
బాలికల పాఠశాల చుట్టూ గోడ లేక భద్రతా సమస్యలు వస్తున్నాయి.,Telugu ,relevant,1,బాలికల పాఠశాల చుట్టూ గోడ లేక భద్రతా సమస్యలు వస్తున్నాయి
సమీపంలోని బ్యాంక్‌లో క్యూ చాలా ఎక్కువగా ఉంటుంది.,Telugu ,relevant,1,సమీపంలోని బ్యాంక్లో క్యూ చాలా ఎక్కువగా ఉంటుంది
ఇంటర్నెట్ కనెక్షన్ చాలా మందికి లభించలేదు.,Telugu ,relevant,1,ఇంటర్నెట్ కనెక్షన్ చాలా మందికి లభించలేదు
వానలు పడితే మా కాలనీ మురుగు నీటిలో మునిగిపోతుంది.,Telugu ,relevant,1,వానలు పడితే మా కాలనీ మురుగు నీటిలో మునిగిపోతుంది
పరీక్షలు రాసిన విద్యార్థులకు ఫలితాలు ప్రకటించడంలో ఆలస్యం అవుతోంది.,Telugu ,relevant,1,పరీక్షలు రాసిన విద్యార్థులకు ఫలితాలు ప్రకటించడంలో ఆలస్యం అవుతోంది
తాగునీరు సరఫరా గడచిన వారం నుండి నిలిచిపోయింది.,Telugu ,relevant,1,తాగునీరు సరఫరా గడచిన వారం నుండి నిలిచిపోయింది
"పౌరులు ఫిర్యాదు చేసినా, అధికారులచే సమస్యలు పట్టించుకోవడం లేదు.",Telugu ,relevant,1,పౌరులు ఫిర్యాదు చేసినా అధికారులచే సమస్యలు పట్టించుకోవడం లేదు
గ్రామంలో ట్యూబ్ వెల్స్ లో నీరు లేక పోతున్నాయి.,Telugu ,relevant,1,గ్రామంలో ట్యూబ్ వెల్స్ లో నీరు లేక పోతున్నాయి
ప్రభుత్వ పాఠశాలల్లో విద్యా సామగ్రి సరిపడా లేదు.,Telugu ,relevant,1,ప్రభుత్వ పాఠశాలల్లో విద్యా సామగ్రి సరిపడా లేదు
గర్భిణీలకు ఆసుపత్రిలో ప్రత్యేక సదుపాయాలు లేవు.,Telugu ,relevant,1,గర్భిణీలకు ఆసుపత్రిలో ప్రత్యేక సదుపాయాలు లేవు
సెలవులు ఉన్నా బస్సులు ఎక్కువగా నడవడం లేదు.,Telugu ,relevant,1,సెలవులు ఉన్నా బస్సులు ఎక్కువగా నడవడం లేదు
నిరుద్యోగులకు మార్గదర్శకత కల్పించడంలో లోపాలున్నాయి.,Telugu ,relevant,1,నిరుద్యోగులకు మార్గదర్శకత కల్పించడంలో లోపాలున్నాయి
పౌరులు సమస్యలు వివరించడానికి ప్రజా దర్బార్‌ నిర్వహించడంలేదు.,Telugu ,relevant,1,పౌరులు సమస్యలు వివరించడానికి ప్రజా దర్బార్ నిర్వహించడంలేదు
నలుగురు కూర్చునే స్థలం లేక చౌక ధరల దుకాణం బయట క్యూ లో నిలబడుతున్నారు.,Telugu ,relevant,1,నలుగురు కూర్చునే స్థలం లేక చౌక ధరల దుకాణం బయట క్యూ లో నిలబడుతున్నారు
చెక్కులు వాయిదా వేయడం వల్ల వృద్ధులకి ఇబ్బంది.,Telugu ,relevant,1,చెక్కులు వాయిదా వేయడం వల్ల వృద్ధులకి ఇబ్బంది
పాఠశాలల్లో మిడ్డే మీల్ అన్నం సరిగా ఉడికించడం లేదు.,Telugu ,relevant,1,పాఠశాలల్లో మిడ్డే మీల్ అన్నం సరిగా ఉడికించడం లేదు
వెళ్తే ప్రభుత్వ ఉద్యోగుల సాయంత్రం 4కి ఆఫీసు మూసేస్తున్నారు.,Telugu ,relevant,1,వెళ్తే ప్రభుత్వ ఉద్యోగుల సాయంత్రం 4కి ఆఫీసు మూసేస్తున్నారు
విద్యార్థులకు స్కాలర్షిప్ డబ్బులు ఆలస్యంగా వస్తున్నాయి.,Telugu ,relevant,1,విద్యార్థులకు స్కాలర్షిప్ డబ్బులు ఆలస్యంగా వస్తున్నాయి
గ్రామీణ ప్రాంతాల్లో హెల్త్ సెంటర్లు తక్కువగా ఉన్నాయి.,Telugu ,relevant,1,గ్రామీణ ప్రాంతాల్లో హెల్త్ సెంటర్లు తక్కువగా ఉన్నాయి
గర్భిణీ స్త్రీలు మినిమం పరీక్షలు చేయించుకోలేని పరిస్థితి.,Telugu ,relevant,1,గర్భిణీ స్త్రీలు మినిమం పరీక్షలు చేయించుకోలేని పరిస్థితి
పట్టణంలో శానిటేషన్ సిబ్బంది తక్కువగా ఉన్నారు.,Telugu ,relevant,1,పట్టణంలో శానిటేషన్ సిబ్బంది తక్కువగా ఉన్నారు
ఎమర్జెన్సీ పరిస్థితుల్లో 108 అంబులెన్స్ ఆలస్యంగా రాగలదు.,Telugu ,relevant,1,ఎమర్జెన్సీ పరిస్థితుల్లో 108 అంబులెన్స్ ఆలస్యంగా రాగలదు
చిన్న చిన్న సమస్యలకే ప్రజలు పట్టణానికి రావాల్సి వస్తోంది.,Telugu ,relevant,1,చిన్న చిన్న సమస్యలకే ప్రజలు పట్టణానికి రావాల్సి వస్తోంది
దివ్యాంగులకు ప్రత్యేక ర్యాంప్ లేక ప్రభుత్వ భవనాల్లోకి చేరలేరు.,Telugu ,relevant,1,దివ్యాంగులకు ప్రత్యేక ర్యాంప్ లేక ప్రభుత్వ భవనాల్లోకి చేరలేరు
ఇంటర్మీడియట్ విద్యార్థులకి మంచి ల్యాబ్ సదుపాయం లేదు.,Telugu ,relevant,1,ఇంటర్మీడియట్ విద్యార్థులకి మంచి ల్యాబ్ సదుపాయం లేదు
పొలీసు స్టేషన్ కి ఫిర్యాదు చేస్తే దర్యాప్తు ఆలస్యం అవుతోంది.,Telugu ,relevant,1,పొలీసు స్టేషన్ కి ఫిర్యాదు చేస్తే దర్యాప్తు ఆలస్యం అవుతోంది
మహిళలపై అఘాయిత్యాలపై చర్యలు తీసుకోవడంలో జాప్యం.,Telugu ,relevant,1,మహిళలపై అఘాయిత్యాలపై చర్యలు తీసుకోవడంలో జాప్యం
అవసరమైన మందులు లేక పోవడం వల్ల ప్రైవేట్ దవాఖానలపై ఆధారపడుతున్నారు.,Telugu ,relevant,1,అవసరమైన మందులు లేక పోవడం వల్ల ప్రైవేట్ దవాఖానలపై ఆధారపడుతున్నారు
ప్రభుత్వ కార్యాలయాల్లో رش్వత లేనిదే పని జరగడం లేదు.,Telugu ,relevant,1,ప్రభుత్వ కార్యాలయాల్లో رش్వత లేనిదే పని జరగడం లేదు
పాఠశాలల్లో డెస్కులు కుర్చీలు పాడైపోయాయి.,Telugu ,relevant,1,పాఠశాలల్లో డెస్కులు కుర్చీలు పాడైపోయాయి
గ్రామాల్లో పాత భవనాలు పడిపోతున్నా బదిలీ చేయడం లేదు.,Telugu ,relevant,1,గ్రామాల్లో పాత భవనాలు పడిపోతున్నా బదిలీ చేయడం లేదు
ప్రజల వాణిజ్య కట్టడాలకు మున్సిపల్ అనుమతులు ఆలస్యంగా వస్తున్నాయి.,Telugu ,relevant,1,ప్రజల వాణిజ్య కట్టడాలకు మున్సిపల్ అనుమతులు ఆలస్యంగా వస్తున్నాయి
విద్యార్థులకు సరైన ట్రాన్స్‌పోర్ట్ సదుపాయం లేదు.,Telugu ,relevant,1,విద్యార్థులకు సరైన ట్రాన్స్పోర్ట్ సదుపాయం లేదు
"ఉచిత బుక్స్ ఇచ్చినపుడు, నాణ్యత విషయంలో లోపాలున్నాయి.",Telugu ,relevant,1,ఉచిత బుక్స్ ఇచ్చినపుడు నాణ్యత విషయంలో లోపాలున్నాయి
రేషన్ కార్డు అప్‌డేట్ చేయాలంటే ఎన్నో లక్కీ డ్రాలా తిప్పలు పడాలి.,Telugu ,relevant,1,రేషన్ కార్డు అప్డేట్ చేయాలంటే ఎన్నో లక్కీ డ్రాలా తిప్పలు పడాలి
ప్రభుత్వ పాఠశాలలో తాగునీటి సమస్య తీవ్రమైంది.,Telugu ,relevant,1,ప్రభుత్వ పాఠశాలలో తాగునీటి సమస్య తీవ్రమైంది
పదవ తరగతి పరీక్ష కేంద్రాల్లో బాగ్స్కానింగ్ సదుపాయం లేదు.,Telugu ,relevant,1,పదవ తరగతి పరీక్ష కేంద్రాల్లో బాగ్స్కానింగ్ సదుపాయం లేదు
పురుషులకి వ్యతిరేకంగా కూడా హింస జరుగుతోందని న్యాయం కావాలి.,Telugu ,relevant,1,పురుషులకి వ్యతిరేకంగా కూడా హింస జరుగుతోందని న్యాయం కావాలి
కుల ఆధారంగా స్కాలర్‌షిప్ ఇవ్వడంపై పలువురికి అభ్యంతరాలు ఉన్నాయి.,Telugu ,relevant,1,కుల ఆధారంగా స్కాలర్షిప్ ఇవ్వడంపై పలువురికి అభ్యంతరాలు ఉన్నాయి
వికలాంగుల ఉద్యోగ నోటిఫికేషన్ లేటుగా విడుదలవుతోంది.,Telugu ,relevant,1,వికలాంగుల ఉద్యోగ నోటిఫికేషన్ లేటుగా విడుదలవుతోంది
ఆధార్ అప్‌డేట్ చేయాలంటే గంటల తరబడి వేచి ఉండాలి.,Telugu ,relevant,1,ఆధార్ అప్డేట్ చేయాలంటే గంటల తరబడి వేచి ఉండాలి
విద్యార్థులకు ల్యాప్‌టాప్‌లు ఇచ్చిన తర్వాత ఫాలోఅప్ లేదు.,Telugu ,relevant,1,విద్యార్థులకు ల్యాప్టాప్లు ఇచ్చిన తర్వాత ఫాలోఅప్ లేదు
ఆర్డీపీ వేదికలపై ప్రజల ప్రశ్నలకు సమాధానాలు లేవు.,Telugu ,relevant,1,ఆర్డీపీ వేదికలపై ప్రజల ప్రశ్నలకు సమాధానాలు లేవు
ప్రభుత్వ హాస్టల్స్‌లో మెస్ ఫుడ్ నాణ్యత తక్కువగా ఉంది.,Telugu ,relevant,1,ప్రభుత్వ హాస్టల్స్లో మెస్ ఫుడ్ నాణ్యత తక్కువగా ఉంది
ఉద్యోగాల రిక్రూట్‌మెంట్ ప్రక్రియ చాలా మందిని నిరాశపరుస్తోంది.,Telugu ,relevant,1,ఉద్యోగాల రిక్రూట్మెంట్ ప్రక్రియ చాలా మందిని నిరాశపరుస్తోంది
వివాహాల కోసం రిజిస్ట్రేషన్ చేయించుకునేందుకు నెత్తిన సర్వర్ పడిపోతుంది.,Telugu ,relevant,1,వివాహాల కోసం రిజిస్ట్రేషన్ చేయించుకునేందుకు నెత్తిన సర్వర్ పడిపోతుంది
గత రెండేళ్లుగా కాలనీకి డ్రైనేజ్ సమస్య పరిష్కారం కాలేదు.,Telugu ,relevant,1,గత రెండేళ్లుగా కాలనీకి డ్రైనేజ్ సమస్య పరిష్కారం కాలేదు
కలెక్టర్ వద్దకు వెళ్లినా సమస్యలపై స్పందన లేదు.,Telugu ,relevant,1,కలెక్టర్ వద్దకు వెళ్లినా సమస్యలపై స్పందన లేదు
పాఠశాల భవనం పాడైపోయినా కొత్త భవన నిర్మాణం లేదు.,Telugu ,relevant,1,పాఠశాల భవనం పాడైపోయినా కొత్త భవన నిర్మాణం లేదు
పట్టణాలలో పబ్లిక్ టాయిలెట్లు పూర్తిగా కాలుష్యంగా ఉన్నాయి.,Telugu ,relevant,1,పట్టణాలలో పబ్లిక్ టాయిలెట్లు పూర్తిగా కాలుష్యంగా ఉన్నాయి
మహిళల ఆపద్ధర్మ కేంద్రం నామమాత్రమే పనిచేస్తోంది.,Telugu ,relevant,1,మహిళల ఆపద్ధర్మ కేంద్రం నామమాత్రమే పనిచేస్తోంది
గ్రామీణ ప్రాంతాల్లో విద్యుత్ అంతరాయం ఎక్కువగా ఉంది.,Telugu ,relevant,1,గ్రామీణ ప్రాంతాల్లో విద్యుత్ అంతరాయం ఎక్కువగా ఉంది
పిల్లలకి బేసిక్ హెల్త్ చెక్‌అప్ సెంటర్లు లేవు.,Telugu ,relevant,1,పిల్లలకి బేసిక్ హెల్త్ చెక్అప్ సెంటర్లు లేవు
మాలిన్య నిర్వహణ తగిన రీతిలో చేయడం లేదు.,Telugu ,relevant,1,మాలిన్య నిర్వహణ తగిన రీతిలో చేయడం లేదు
గ్రామీణ యువతకి స్కిల్ డెవలప్‌మెంట్ అవకాశాలు తక్కువ.,Telugu ,relevant,1,గ్రామీణ యువతకి స్కిల్ డెవలప్మెంట్ అవకాశాలు తక్కువ
వృద్ధాశ్రమాల పరిస్థితి చూస్తే మనసు కలచివేస్తుంది.,Telugu ,relevant,1,వృద్ధాశ్రమాల పరిస్థితి చూస్తే మనసు కలచివేస్తుంది
పిల్లలపై శారీరక దండనలు ఇంకా కొనసాగుతూనే ఉన్నాయి.,Telugu ,relevant,1,పిల్లలపై శారీరక దండనలు ఇంకా కొనసాగుతూనే ఉన్నాయి
ఉచిత సదుపాయాల గురించి ప్రజలకు సరైన అవగాహన లేదు.,Telugu ,relevant,1,ఉచిత సదుపాయాల గురించి ప్రజలకు సరైన అవగాహన లేదు
పాఠశాలల పునరుద్ధరణ పనులు మధ్యలోనే నిలిచిపోయాయి.,Telugu ,relevant,1,పాఠశాలల పునరుద్ధరణ పనులు మధ్యలోనే నిలిచిపోయాయి
ఆరోగ్య సేవల కోసం దూర ప్రాంతాలకు ప్రయాణించాల్సి వస్తుంది.,Telugu ,relevant,1,ఆరోగ్య సేవల కోసం దూర ప్రాంతాలకు ప్రయాణించాల్సి వస్తుంది
కనీస వేతనాలు ఇంకా అమలులోకి రాలేదు.,Telugu ,relevant,1,కనీస వేతనాలు ఇంకా అమలులోకి రాలేదు
అధికారుల నుంచి పారదర్శకత తక్కువగా ఉంది.,Telugu ,relevant,1,అధికారుల నుంచి పారదర్శకత తక్కువగా ఉంది
విద్యార్థులకు స్కాలర్షిప్ డబ్బులు తప్పుగా జమ అవుతున్నాయి.,Telugu ,relevant,1,విద్యార్థులకు స్కాలర్షిప్ డబ్బులు తప్పుగా జమ అవుతున్నాయి
చాలా ప్రాంతాల్లో ఆర్టీసీ బస్సుల రూట్లు రద్దయిపోయాయి.,Telugu ,relevant,1,చాలా ప్రాంతాల్లో ఆర్టీసీ బస్సుల రూట్లు రద్దయిపోయాయి
పబ్లిక్ పార్కుల నిర్వహణ సరిగ్గా చేయడం లేదు.,Telugu ,relevant,1,పబ్లిక్ పార్కుల నిర్వహణ సరిగ్గా చేయడం లేదు
