text,language,label,label_num,clean_text
నీ గుద్దను చీకు వేసే విధంగా ప్రజలు చూస్తున్నారు  ,Telugu ,abusive,0,నీ గుద్దను చీకు వేసే విధంగా ప్రజలు చూస్తున్నారు
గుద్ధా కింద కొవ్వు పట్టిందా నీ మాటలకు బలం లేదు  ,Telugu ,abusive,0,గుద్ధా కింద కొవ్వు పట్టిందా నీ మాటలకు బలం లేదు
హస్త ప్రయోగం చేసి ఓట్లు గెలుచుకున్న నాయకులు మీ పార్టీ  ,Telugu ,abusive,0,హస్త ప్రయోగం చేసి ఓట్లు గెలుచుకున్న నాయకులు మీ పార్టీ
కమ్మని పూకుతో నీ హామీలు ప్రజల్ని మాయ చేశాయి  ,Telugu ,abusive,0,కమ్మని పూకుతో నీ హామీలు ప్రజల్ని మాయ చేశాయి
కోజ్జా రాజకీయాలే ఇప్పుడు ప్రజల పరిస్థితి  ,Telugu ,abusive,0,కోజ్జా రాజకీయాలే ఇప్పుడు ప్రజల పరిస్థితి
కోజ్జా ముండా లాంటి నీవే ప్రభుత్వ హీనతకు కారణం  ,Telugu ,abusive,0,కోజ్జా ముండా లాంటి నీవే ప్రభుత్వ హీనతకు కారణం
కొనమొడ్డా లాంటి పథకాలు ఎవరి పని కావు  ,Telugu ,abusive,0,కొనమొడ్డా లాంటి పథకాలు ఎవరి పని కావు
గుద్దా చించీ పగల్ దెంగుతా అన్నట్టే నీ ప్రభుత్వ పని  ,Telugu ,abusive,0,గుద్దా చించీ పగల్ దెంగుతా అన్నట్టే నీ ప్రభుత్వ పని
కుక్క - పూకా లాంటి మాటలే నీ సభల పరమార్థం  ,Telugu ,abusive,0,కుక్క పూకా లాంటి మాటలే నీ సభల పరమార్థం
కుక్క సుల్లీ రాజకీయాలే ఈ దేశం దిగజారిపోయింది  ,Telugu ,abusive,0,కుక్క సుల్లీ రాజకీయాలే ఈ దేశం దిగజారిపోయింది
కుత్తా చింపి పర దెంగుతా అన్నట్టు మోసం చేస్తున్నావు  ,Telugu ,abusive,0,కుత్తా చింపి పర దెంగుతా అన్నట్టు మోసం చేస్తున్నావు
కూతురు వొంగుడు అల్లుడు దెంగుడు అనేలా నీ పాలన ఉంది  ,Telugu ,abusive,0,కూతురు వొంగుడు అల్లుడు దెంగుడు అనేలా నీ పాలన ఉంది
లంజా మాటలతో రాజకీయ నాయకులు కలుషితం చేస్తున్నారు  ,Telugu ,abusive,0,లంజా మాటలతో రాజకీయ నాయకులు కలుషితం చేస్తున్నారు
లంజా కొడకా నీవే ప్రజల మతాన్ని దెబ్బతీసేవాడు  ,Telugu ,abusive,0,లంజా కొడకా నీవే ప్రజల మతాన్ని దెబ్బతీసేవాడు
లంజా ముండా గోచి ప్రజల నమ్మకాన్ని వంచించిన వాడు  ,Telugu ,abusive,0,లంజా ముండా గోచి ప్రజల నమ్మకాన్ని వంచించిన వాడు
లంజా పూకాతో నీ ప్రచారం ఒక్కటే బలహీనత  ,Telugu ,abusive,0,లంజా పూకాతో నీ ప్రచారం ఒక్కటే బలహీనత
లంజకోడకా ప్రభుత్వాన్ని గుడ్డిగా నడుపుతున్నావు  ,Telugu ,abusive,0,లంజకోడకా ప్రభుత్వాన్ని గుడ్డిగా నడుపుతున్నావు
లేకి పూకా అభిప్రాయాలతో ప్రజలపై ఆధిపత్యం చూపిస్తున్నావు  ,Telugu ,abusive,0,లేకి పూకా అభిప్రాయాలతో ప్రజలపై ఆధిపత్యం చూపిస్తున్నావు
నీ పాలన మల్వికా లాంటి చీకటి కామెడీ  ,Telugu ,abusive,0,నీ పాలన మల్వికా లాంటి చీకటి కామెడీ
మర్మాంగంతో మాట్లాడే నీచ నేతలే ప్రజల గతి  ,Telugu ,abusive,0,మర్మాంగంతో మాట్లాడే నీచ నేతలే ప్రజల గతి
నీ మోడ్డా పాలన వల్ల యువతకు మార్గం లేదు  ,Telugu ,abusive,0,నీ మోడ్డా పాలన వల్ల యువతకు మార్గం లేదు
మోడ్డా చీకు లంజా లాంటి సమాజాన్ని మోసం చేస్తున్నావు  ,Telugu ,abusive,0,మోడ్డా చీకు లంజా లాంటి సమాజాన్ని మోసం చేస్తున్నావు
మోడ్డా కుడువు లాంటి హామీలతో ఓట్లు కొట్టుకున్నావు  ,Telugu ,abusive,0,మోడ్డా కుడువు లాంటి హామీలతో ఓట్లు కొట్టుకున్నావు
మోడ్డా నాకూ అనేలా ఆవేశంగా మాట్లాడుతున్నావు సభలో  ,Telugu ,abusive,0,మోడ్డా నాకూ అనేలా ఆవేశంగా మాట్లాడుతున్నావు సభలో
మోడ్డా నోట్లో పెట్టి దెంగుతా అన్నట్టే తప్పుడు హామీలు  ,Telugu ,abusive,0,మోడ్డా నోట్లో పెట్టి దెంగుతా అన్నట్టే తప్పుడు హామీలు
"మోడ్డా, లవడా, దద్దు, మగతనం లాంటి అసహ్యమైన రాజకీయాలు  ",Telugu ,abusive,0,మోడ్డా లవడా దద్దు మగతనం లాంటి అసహ్యమైన రాజకీయాలు
ముళ్ళు మొనా లాంటి మాటలే ప్రజల నోళ్ళలో ఉన్నాయి  ,Telugu ,abusive,0,ముళ్ళు మొనా లాంటి మాటలే ప్రజల నోళ్ళలో ఉన్నాయి
మడ్డి లో వేళ్ళు పెట్టుకుని పరిపాలన చేస్తున్నావు  ,Telugu ,abusive,0,మడ్డి లో వేళ్ళు పెట్టుకుని పరిపాలన చేస్తున్నావు
నా మోడ్డా గుద్దు లాంటి వాగ్దానాలు మోసం చేశాయి  ,Telugu ,abusive,0,నా మోడ్డా గుద్దు లాంటి వాగ్దానాలు మోసం చేశాయి
నీ అక్కను దెంగా అనేలా మాటలు మాట్లాడుతున్నావు  ,Telugu ,abusive,0,నీ అక్కను దెంగా అనేలా మాటలు మాట్లాడుతున్నావు
నీ అక్కను మా కుక్క దెంగా అన్నట్టు నిందలు వేస్తున్నావు  ,Telugu ,abusive,0,నీ అక్కను మా కుక్క దెంగా అన్నట్టు నిందలు వేస్తున్నావు
నీ అమ్మని దెంగా అన్నట్టు నాయకత్వం లేకపోవడం  ,Telugu ,abusive,0,నీ అమ్మని దెంగా అన్నట్టు నాయకత్వం లేకపోవడం
నీ అమ్మ పూకులో నా మోడ్డా పెట్టి నిన్నే తిట్టాలి  ,Telugu ,abusive,0,నీ అమ్మ పూకులో నా మోడ్డా పెట్టి నిన్నే తిట్టాలి
నీ జాతిని కుక్క దెంగా అన్నట్టు నీ సంస్కృతి  ,Telugu ,abusive,0,నీ జాతిని కుక్క దెంగా అన్నట్టు నీ సంస్కృతి
నీ మామ పూకు దెంగా అనేలా మత పిచ్చి పెడుతున్నావు  ,Telugu ,abusive,0,నీ మామ పూకు దెంగా అనేలా మత పిచ్చి పెడుతున్నావు
నీ నోట్లో నా సుల్లీ అన్నట్టు తిట్లే వినిపిస్తున్నాయి  ,Telugu ,abusive,0,నీ నోట్లో నా సుల్లీ అన్నట్టు తిట్లే వినిపిస్తున్నాయి
నీ పూకుల నా సుల్లీ అన్నట్టు ప్రజల విసుగు  ,Telugu ,abusive,0,నీ పూకుల నా సుల్లీ అన్నట్టు ప్రజల విసుగు
నీ ఆలీ పూకులో రాంపం పెట్టినట్టు అసభ్య సంస్కరణలు  ,Telugu ,abusive,0,నీ ఆలీ పూకులో రాంపం పెట్టినట్టు అసభ్య సంస్కరణలు
నీ అక్కని దెంగా అంటూ నన్ను దూషిస్తావా  ,Telugu ,abusive,0,నీ అక్కని దెంగా అంటూ నన్ను దూషిస్తావా
నీ అమ్మగారిని దెంగా అన్నట్టు నీ మాటల లోపం  ,Telugu ,abusive,0,నీ అమ్మగారిని దెంగా అన్నట్టు నీ మాటల లోపం
నీ అలిని దెంగా అని తిట్టే స్థాయిలో నిలిపేశావు ప్రజల మనసుల్లో  ,Telugu ,abusive,0,నీ అలిని దెంగా అని తిట్టే స్థాయిలో నిలిపేశావు ప్రజల మనసుల్లో
నీ అమ్మ గుద్దని దెంగా అన్నట్టు న్యాయం లేదు  ,Telugu ,abusive,0,నీ అమ్మ గుద్దని దెంగా అన్నట్టు న్యాయం లేదు
నీ అమ్మ కుట్టనిని దెంగా అంటూ ఆవేదన వ్యక్తం చేస్తున్నారు ప్రజలు  ,Telugu ,abusive,0,నీ అమ్మ కుట్టనిని దెంగా అంటూ ఆవేదన వ్యక్తం చేస్తున్నారు ప్రజలు
నీ అమ్మ పూకులో సుల్లీ పెట్టినట్టే నీ పాలన  ,Telugu ,abusive,0,నీ అమ్మ పూకులో సుల్లీ పెట్టినట్టే నీ పాలన
నీ అమ్మ రోజు నా మోడ్డా చీకుతుందని ప్రజలు ఆవేదన చెందుతున్నారు  ,Telugu ,abusive,0,నీ అమ్మ రోజు నా మోడ్డా చీకుతుందని ప్రజలు ఆవేదన చెందుతున్నారు
నీ అమ్మనీ దెంగా అంటూ నీ కార్యకలాపాలు ప్రజల దృష్టిలో  ,Telugu ,abusive,0,నీ అమ్మనీ దెంగా అంటూ నీ కార్యకలాపాలు ప్రజల దృష్టిలో
నీ అమ్మనూ దెంగా అంటూ విరోధి పార్టీలు అంటున్నాయి  ,Telugu ,abusive,0,నీ అమ్మనూ దెంగా అంటూ విరోధి పార్టీలు అంటున్నాయి
నీ అమ్మను దెంగా అని ప్రజలు చెప్పేలా పాలన ఉంది  ,Telugu ,abusive,0,నీ అమ్మను దెంగా అని ప్రజలు చెప్పేలా పాలన ఉంది
నీ కూతుర్ని దెంగా అనేలా ప్రజల ఆగ్రహం  ,Telugu ,abusive,0,నీ కూతుర్ని దెంగా అనేలా ప్రజల ఆగ్రహం
నీ నోట్లో నా సుల్లీ పెట్టి మాట్లాడుతున్నావు అన్నట్టు విరోధం  ,Telugu ,abusive,0,నీ నోట్లో నా సుల్లీ పెట్టి మాట్లాడుతున్నావు అన్నట్టు విరోధం
నీ పళ్ళు సూపర్ అంటూ చీల్చి మాట్లాడుతున్నావు  ,Telugu ,abusive,0,నీ పళ్ళు సూపర్ అంటూ చీల్చి మాట్లాడుతున్నావు
నీ పాయల్ మధ్యలో నా సుల్లీ వేసి మాటలాడుతున్నావు  ,Telugu ,abusive,0,నీ పాయల్ మధ్యలో నా సుల్లీ వేసి మాటలాడుతున్నావు
నీ పెళ్లాన్ని దెంగా అన్నట్టు సంస్కార భంగం  ,Telugu ,abusive,0,నీ పెళ్లాన్ని దెంగా అన్నట్టు సంస్కార భంగం
నీ పూకు చెకుత కలుషితమైన మాటలే  ,Telugu ,abusive,0,నీ పూకు చెకుత కలుషితమైన మాటలే
నీ పూకులో నా గుద్ద పెట్టి ప్రభుత్వాన్ని నడుపుతున్నావు  ,Telugu ,abusive,0,నీ పూకులో నా గుద్ద పెట్టి ప్రభుత్వాన్ని నడుపుతున్నావు
నీ పూకులో నా సుల్లీ పెట్టి నీ మాటలు చెత్తగా మారాయి  ,Telugu ,abusive,0,నీ పూకులో నా సుల్లీ పెట్టి నీ మాటలు చెత్తగా మారాయి
నీ అక్కని పండ్లు దెంగా అన్నట్టు అన్యాయం  ,Telugu ,abusive,0,నీ అక్కని పండ్లు దెంగా అన్నట్టు అన్యాయం
నీ గుద్ధా లా గుద్దు పెడతా అన్నట్టు ఓటర్ల మీద తప్పుడు ప్రయోగం  ,Telugu ,abusive,0,నీ గుద్ధా లా గుద్దు పెడతా అన్నట్టు ఓటర్ల మీద తప్పుడు ప్రయోగం
నీ పూకుల నా మడ్డా అన్నట్టే అబద్ధాల రాజ్యం  ,Telugu ,abusive,0,నీ పూకుల నా మడ్డా అన్నట్టే అబద్ధాల రాజ్యం
నిహార్ లాంటి బండా పూకు మాటలు ప్రచారంగా మారాయి  ,Telugu ,abusive,0,నిహార్ లాంటి బండా పూకు మాటలు ప్రచారంగా మారాయి
నిన్ను దెంగుతా అన్నట్టే ప్రజల ఆగ్రహం  ,Telugu ,abusive,0,నిన్ను దెంగుతా అన్నట్టే ప్రజల ఆగ్రహం
నువ్వు నీ ఎండిపోయిన సుల్లీతో నడుపుతున్న రాజకీయాలు  ,Telugu ,abusive,0,నువ్వు నీ ఎండిపోయిన సుల్లీతో నడుపుతున్న రాజకీయాలు
పాకీ ముండా లాంటి సభలు ప్రజలను విసుగ పెడుతున్నాయి  ,Telugu ,abusive,0,పాకీ ముండా లాంటి సభలు ప్రజలను విసుగ పెడుతున్నాయి
పెద్ద సల్లాధి నాయకత్వం నీకే చెల్లింది  ,Telugu ,abusive,0,పెద్ద సల్లాధి నాయకత్వం నీకే చెల్లింది
పిచ్చి పూకోడా నాయకులు పాలనలో ఉండకూడదు  ,Telugu ,abusive,0,పిచ్చి పూకోడా నాయకులు పాలనలో ఉండకూడదు
పిచ్చి పూకుదానా లాంటి ప్రసంగాలు  ,Telugu ,abusive,0,పిచ్చి పూకుదానా లాంటి ప్రసంగాలు
పియ్య తిన్నావా రా మోసగాడా  ,Telugu ,abusive,0,పియ్య తిన్నావా రా మోసగాడా
పోయి వొంగు రా అని ప్రజలు చెప్పేలా చేశావు  ,Telugu ,abusive,0,పోయి వొంగు రా అని ప్రజలు చెప్పేలా చేశావు
నీ పూకు పగలదెంగుతా అన్నట్టు రోజూ మీడియా నిండుతుంది  ,Telugu ,abusive,0,నీ పూకు పగలదెంగుతా అన్నట్టు రోజూ మీడియా నిండుతుంది
"పూకు, డిమ్మా, పప్పా, బొక్కా లాంటి మాటలే సభలో వినిపిస్తున్నాయి  ",Telugu ,abusive,0,పూకు డిమ్మా పప్పా బొక్కా లాంటి మాటలే సభలో వినిపిస్తున్నాయి
పూకు చించు అని ఓటర్లు తిరగబడుతున్నారు  ,Telugu ,abusive,0,పూకు చించు అని ఓటర్లు తిరగబడుతున్నారు
పూక్చి నా కొడకా అనేలా స్పందన ఉంది  ,Telugu ,abusive,0,పూక్చి నా కొడకా అనేలా స్పందన ఉంది
పుక్కు నాకూ అనేలా తిట్టేస్తున్నారు  ,Telugu ,abusive,0,పుక్కు నాకూ అనేలా తిట్టేస్తున్నారు
పూకు పేక అడిస్తా అన్నట్టు న్యాయం లేదు  ,Telugu ,abusive,0,పూకు పేక అడిస్తా అన్నట్టు న్యాయం లేదు
పుత్థి మాటలతో ప్రజలను మోసం చేస్తున్నావు  ,Telugu ,abusive,0,పుత్థి మాటలతో ప్రజలను మోసం చేస్తున్నావు
సచినోడా నీ వెధవ నాయకత్వం మిగిలింది  ,Telugu ,abusive,0,సచినోడా నీ వెధవ నాయకత్వం మిగిలింది
సల్లూ దెంగుతా అన్నట్టు నీ ప్రభుత్వ తీరు  ,Telugu ,abusive,0,సల్లూ దెంగుతా అన్నట్టు నీ ప్రభుత్వ తీరు
సనాలో బోచ్చో అనేలా అవమానాలు  ,Telugu ,abusive,0,సనాలో బోచ్చో అనేలా అవమానాలు
శాటా వేషాలు వేసి ప్రజల దృష్టిని మాయ చేస్తున్నావు  ,Telugu ,abusive,0,శాటా వేషాలు వేసి ప్రజల దృష్టిని మాయ చేస్తున్నావు
శ్రవణ్ లేదా కొండా వెర్రి పూకు లాంటి నాయకత్వం  ,Telugu ,abusive,0,శ్రవణ్ లేదా కొండా వెర్రి పూకు లాంటి నాయకత్వం
సులీ పట్టి మాట్లాడే నీచ నాయకులు ప్రజలకు దుర్మార్గం  ,Telugu ,abusive,0,సులీ పట్టి మాట్లాడే నీచ నాయకులు ప్రజలకు దుర్మార్గం
తేజా లేదా అడవి పూకు లాంటి వ్యాఖ్యలు  ,Telugu ,abusive,0,తేజా లేదా అడవి పూకు లాంటి వ్యాఖ్యలు
తేజా త్రివిక్రమ్ – అడవి పూకు అని విరోధుల కామెంట్  ,Telugu ,abusive,0,తేజా త్రివిక్రమ్ అడవి పూకు అని విరోధుల కామెంట్
తుర్కు వాలగొడతా అనేలా మాటలు చెప్పడం  ,Telugu ,abusive,0,తుర్కు వాలగొడతా అనేలా మాటలు చెప్పడం
వట్టకాయి లాంటి నీ పాలన ప్రజలను హేళన చేస్తోంది  ,Telugu ,abusive,0,వట్టకాయి లాంటి నీ పాలన ప్రజలను హేళన చేస్తోంది
వట్టాలు లాంటి నీ హామీలు వృథా  ,Telugu ,abusive,0,వట్టాలు లాంటి నీ హామీలు వృథా
వెధవా మాటలు జాగ్రత్తగా వాడుకో  ,Telugu ,abusive,0,వెధవా మాటలు జాగ్రత్తగా వాడుకో
వెర్రి పూకా నాయకత్వం నాశనం చేస్తోంది  ,Telugu ,abusive,0,వెర్రి పూకా నాయకత్వం నాశనం చేస్తోంది
వొంగో పెట్టి దెంగుతా లంజా అనేలా వాగ్దానాలు ఉన్నవి  ,Telugu ,abusive,0,వొంగో పెట్టి దెంగుతా లంజా అనేలా వాగ్దానాలు ఉన్నవి
పూకు  ,Telugu ,abusive,0,పూకు
లంగా  ,Telugu ,abusive,0,లంగా
దెంగు  ,Telugu ,abusive,0,దెంగు
మోడ్డా  ,Telugu ,abusive,0,మోడ్డా
గుద్ద  ,Telugu ,abusive,0,గుద్ద
సుల్లీ  ,Telugu ,abusive,0,సుల్లీ
లంజా  ,Telugu ,abusive,0,లంజా
కుక్క  ,Telugu ,abusive,0,కుక్క
పుక్కు  ,Telugu ,abusive,0,పుక్కు
కొడకా  ,Telugu ,abusive,0,కొడకా
చీకు  ,Telugu ,abusive,0,చీకు
పుత్తి  ,Telugu ,abusive,0,పుత్తి
చిత్తు  ,Telugu ,abusive,0,చిత్తు
బోచ్చు  ,Telugu ,abusive,0,బోచ్చు
బోసుడి  ,Telugu ,abusive,0,బోసుడి
మల్లు  ,Telugu ,abusive,0,మల్లు
వెధవ  ,Telugu ,abusive,0,వెధవ
దద్దమ్మ  ,Telugu ,abusive,0,దద్దమ్మ
దొడ్డ  ,Telugu ,abusive,0,దొడ్డ
దాడి  ,Telugu ,abusive,0,దాడి
కుత్తా  ,Telugu ,abusive,0,కుత్తా
పిప్పి  ,Telugu ,abusive,0,పిప్పి
దెబ్బ  ,Telugu ,abusive,0,దెబ్బ
కొజ్జా  ,Telugu ,abusive,0,కొజ్జా
దెంగినవాడు  ,Telugu ,abusive,0,దెంగినవాడు
గూబి  ,Telugu ,abusive,0,గూబి
గడ్డం  ,Telugu ,abusive,0,గడ్డం
బండా  ,Telugu ,abusive,0,బండా
తిన్నావా  ,Telugu ,abusive,0,తిన్నావా
గజ్జి  ,Telugu ,abusive,0,గజ్జి
మడ్డా  ,Telugu ,abusive,0,మడ్డా
బొమ్మ  ,Telugu ,abusive,0,బొమ్మ
బొచ్చు  ,Telugu ,abusive,0,బొచ్చు
తలకొట్ట  ,Telugu ,abusive,0,తలకొట్ట
తలలేని  ,Telugu ,abusive,0,తలలేని
సల్లాధి  ,Telugu ,abusive,0,సల్లాధి
తురుము  ,Telugu ,abusive,0,తురుము
బొక్క  ,Telugu ,abusive,0,బొక్క
కురికించి  ,Telugu ,abusive,0,కురికించి
చిమ్పి  ,Telugu ,abusive,0,చిమ్పి
నోటిలో  ,Telugu ,abusive,0,నోటిలో
గుద్దలో  ,Telugu ,abusive,0,గుద్దలో
మగతనం  ,Telugu ,abusive,0,మగతనం
బుద్ధిలేని  ,Telugu ,abusive,0,బుద్ధిలేని
కాముకుడు  ,Telugu ,abusive,0,కాముకుడు
అలక్ష్యం  ,Telugu ,abusive,0,అలక్ష్యం
